Panel de Haut Niveau;HLP16;Proposition d'une approche systémique pour fournir de l'eau aux populations;Mercredi 23 mars de 13.30 à 15.00;Mercredi 23 mars de 13.30 à 15.00;Salle 12;"En s'appuyant sur la GIRE, le groupe de travail GIRE/transversalité du Conseil mondial de l'eau travaille sur une nouvelle vision de la gestion de l'eau dans le but d'avoir un impact sur la réalisation des ODD, d'identifier les obstacles à la mise à l'échelle et de fournir une vision systémique et des orientations claires en vue d'une répartition équitable de l'eau entre les besoins sectoriels par le biais d'un dialogue et de discussions sur les compromis avec les parties prenantes (communautés locales, secteurs public et privé, universités et organes directeurs, etc.) L'exploration des liens entre l'eau, l'énergie, l'alimentation, la santé et l'éducation contribuera à la réalisation de synergies entre ces secteurs. La vision inclura la prise en compte des sources alternatives (recyclage, traitement, réutilisation), l'efficacité de l'utilisation de l'eau, la gouvernance de l'eau et les eaux transfrontalières. Les objectifs de la session sont les suivants 
1.	Présenter une vision préliminaire Approche systémique pour fournir de l'eau aux populations
2.	Solliciter les réactions de la communauté de l'eau au sujet de cette vision. 
Les résultats de la session seront consignés dans une vision actualisée de la distribution de l'eau aux populations.";"Aperçu de la session / introduction : (5 min) co-organisateurs
Interventions des panélistes (7 min chacune, 4-6 panélistes) 
Discussion modérée (30 min) ";GIRE | productivité de l'eau | éducation | Nexus du WEF | éducation | santé ;Texas A&M University;90'
Panel de Haut Niveau;HLP17;Dialogues sur les politiques à mener dans les pays où l'eau est rare pour atteindre les ODD : vers la conférence des Nations unies sur l'examen global à mi-parcours de la Décennie d'action sur l'eau;Mardi 22 mars de 9.00 à 10.30;Mardi 22 mars de 9.00 à 10.30;Salle 205;"Le ministère égyptien des Ressources en eau et de l'Irrigation (MWRI) a organisé le deuxième segment H.L. d'une série de réunions internationales visant à élaborer les messages des pays souffrant de pénurie d'eau qui seront soumis à la conférence des Nations unies sur l'examen global à mi-parcours de la Décennie d'action pour l'eau, en mars 2023. Les partenaires régionaux et internationaux soutiennent la feuille de route pour les dialogues politiques dans les pays en manque d'eau afin d'atteindre les ODD. Les questions soulevées lors du segment de haut niveau de la Semaine de l'eau du Caire 2021 (CWW2021) seront discutées dans une série d'événements régionaux à partir du 9ème WWF Dakar 2022, en coopération avec les organisations et partenaires concernés. Les principales conclusions du segment de haut niveau de la CWW2021 comprenaient cinq points principaux : (1) Pénurie d'eau et accessibilité ; (2) Coopération sur l'eau et le climat ; (3) Finance : Défis et opportunités ; (4) Outils d'innovation pour la gestion durable de l'eau et (5) Coopération transfrontalière : Opportunités et défis. Ces discussions visent à inverser la tendance en ce qui concerne la mise en œuvre intersectorielle des objectifs et cibles liés à l'eau de l'Agenda 2030 pour le développement durable. 

L'objectif de la session est de recueillir les messages des pays en manque d'eau pour faire face aux résolutions de l'Assemblée générale des Nations unies, proclamant la période 2018 à 2028. La Décennie internationale d'action : L'eau pour le développement durable Résolution 73/226 de l'AGNU Décide de convoquer, à New York, du 22 au 24 mars 2023, la Conférence des Nations Unies sur l'examen global à mi-parcours de ""l'eau pour le développement durable"". En outre, la résolution 75/212 de l'AGNU indique que la conférence d'examen à mi-parcours sera précédée de réunions préparatoires régionales et mondiales et sera alimentée par les discussions existantes sur l'eau aux niveaux régional et international.
La gestion intégrée des ressources en eau reconnaît que l'eau doit être gérée comme un système - où les frontières des systèmes d'eau ne correspondent souvent pas aux frontières politiques ou administratives. Par conséquent, des solutions intégrées sont nécessaires pour parvenir à une bonne gouvernance et accroître l'efficacité et la durabilité de l'utilisation de l'eau, suivies d'une mise en œuvre intersectorielle pratique et coordonnée. De telles actions permettraient d'améliorer la réalisation de l'objectif ""Faim zéro"" et contribueraient de manière significative aux autres objectifs.

L'Égypte attache une grande importance à la Décennie d'action des Nations unies pour l'eau et le développement durable (2018-2028) et à la conférence d'examen à mi-parcours des Nations unies en 2023, la première conférence des Nations unies sur l'eau depuis 1977. Cette importance émane du caractère indispensable de l'eau pour la vie humaine, car les êtres humains n'ont pas d'autre source que l'eau pour la vie, l'alimentation et l'agriculture. En outre, l'eau joue un rôle important dans le développement durable et l'intégration régionale, entre autres. Par conséquent, la préparation de la Conférence 2023, la Conférence elle-même et son suivi sont cruciaux pour créer une dynamique politique en vue d'atteindre l'ODD 6 et d'autres objectifs et cibles liés à l'eau. Dans ce contexte, le gouvernement de la République arabe d'Égypte a inclus les deux sessions de la Semaine de l'eau du Caire d'octobre 2021 et de novembre 2022 et d'autres événements internationaux pertinents, y compris le 9e FME, dans le cadre des réunions préparatoires à la Conférence d'examen à mi-parcours de 2023, afin de contribuer à la formation d'un consensus avant la Conférence et de fournir des contributions substantielles.";"Remarques d'ouverture : (15 min)
o S.E. Dr. Mohamed Abdel-Aty, Ministre des Ressources en eau et de l'Irrigation, Egypte
o M. Loïc Fauchon, Président du Conseil mondial de l'eau.
Discussions de groupe : (75 min)";Régions pauvres en eau | changement climatique | Décennie d'action pour l'eau | ODD | financement | innovation ;"Head of Planning Sector
Executive Director, Cairo Water Week Permanent Secretariat
Ministry of Water Resources and Irrigation
";90'
Panel de Haut Niveau;HLP18;"Table ronde de haut niveau sur le changement climatique : ""Solutions climatiques innovantes dans le secteur de l'eau"".";Mardi 22 mars de 9.00 à 10.30;Mardi 22 mars de 9.00 à 10.30;Salle 3;"Background
- As the world faces deteriorating environmental conditions, dense populations, and rapid economic growth, Africa and Asia are highly vulnerable to climate change. They must be considered as strategically important locations in responding to global climate change.
i) Throughout the high-level discussion on supporting multilateral cooperation, Asia Water Council aims to address the importance of the role of each stakeholder, specifically policy makers, to contribute towards the dissemination and expansion of efforts in overcoming the climate crisis and achieving the Sustainable Development Goals (SDGs).
ii) Throughout an honorable global leader’s participation, Former UN Secretary Ki-moon Ban, the session will provide a new opportunity to vulnerable climate countries via addressing the importance of worldwide solidarity and response.

The session goals
- Addressing the importance of the strategic approaches in responding to the climate change
- Emphasizing the roles of decision-makers on innovative solutions to water-related challenges in regions (incl. a presentation for the result of 'the Statement of Asia to World' initiated during the Asia World Water Week)
- Presenting expected outcomes and synergies of global climate/water platforms, such as COP, WWF, and Asia World Water Week";"(10 min) Aperçu de la session / introduction par les organisateurs 
(10 min) Discours principal
(40 min) Interventions des panélistes - 5 min chacune, 6-8 panélistes
(20 min) Discussion avec modérateur
(10 min) Récapitulation et clôture par les organisateurs";Solution innovante | Plate-forme mondiale | GDS & GIRE | Net-Zéro | ODD;Asia Water Council;90'
Panel de Haut Niveau;HLP19;La coopération en langue portugaise dans le cadre de l’approvisionnement de l’eau et d’assainissement – perspectives politiques et institutionnelles;Mardi 22 mars de 9.00 à 10.30;Mardi 22 mars de 9.00 à 10.30;Salle 10;La session se propose de réfléchir au rôle de la coopération internationale dans la réalisation de l'ODD6 en prenant en considération les projets concrets existant dans les pays lusophones. Cette session tentera d'identifier les principaux succès obtenus, mais aussi les principaux défis à venir. Le partage d'expériences permet la diffusion de solutions adaptées à la réalité de chaque pays.;"10 min.
Le rôle de la coopération portugaise dans le secteur de l'eau et de l'assainissement sur les pays lusophones.
20 min.
Intervention du Ministre de l'Energie et de l'Eau de l'Angola en sa qualité de Président de la Communauté des Pays de Langue Portugaise.
30 min.
Le rôle de la coopération brésilienne dans le secteur de l'eau et de l'assainissement sur les pays lusophones.
40 min.
Solutions des pays lusophones aux défis mondiaux - intervention de M. Rui Godinho, membre du conseil d'administration et du bureau du Conseil mondial de l'eau.
50 min.
Solutions aux défis mondiaux dans les pays lusophones - intervention de M. Jorge Werneck, membre du conseil d'administration et du bureau du Conseil mondial de l'eau.
1h10
Intervention du Secrétaire exécutif de la Communauté des pays de langue portugaise.
1h30
Questions de l'auditoire et débat.
";WASH pour tous | Coopération | Lusophonie | Sécurité;Ministry of Environment and Climate Action of Portugal;90'
Panel de Haut Niveau;HLP20;ALLIANCES POUR L’ODD 6 ;Mardi 22 mars de 9.00 à 10.30;Mardi 22 mars de 9.00 à 10.30;Salle 201;"L’ODD 6 de l’Agenda 2030 veut  “Garantir la disponibilité et la gestion durable de l’eau et des conditions d’assainissement”, mais l’importance de l’eau est évidente également pour la réussite des autres objectifs marqués par l’ Agenda 2030. De plus, dans le contexte mondial actuel de pandémie sanitaire,  l’eau joue un rôle central pour la récupération économique et sanitaires des états, elle favorise la résilience, les opportunités d’emploi et les bénéfices pour la santé et l’accès à un financement  innovant. 

Le Cadre de l’Accélération globale de l’ODD 6 s’est mise en marche durant la session de juillet 2020 du Forum Politique du Haut Niveau sur le Développement dans le but d’appuyer le progrès accélérer des pays dans cinq domaines liés à l’ODD6 : financement, donnés et information, développement des capacités, innovation et gouvernance.

Cependant, l’ODD essentiel pour réussir l’Agenda 2030 est l’ODD 17, concernant les Alliances pour la consécution des objectifs. «Los services d’Eau sont durables seulement lorsqu’ils sont rattaché à une gestion rationnelle des ressources hydriques, quand la gouvernance est assurée et quand est renforcée la participation de tous les secteurs et acteurs essentiels » , indique  ONU-Eau dans un communiqué préalable dirigé aux ministres participants au Forum Politique de Haut Niveau sur le Développement Durable de 2020.
De plus, tel que l’a affirmé le SG des Nations Unies, M. Antonio Guterres, lors du Forum Mondial sur ODD, la pandémie de COVID-19 nous a appris  que « plus que jamais la coopération, les alliances et le multilatéralisme doivent être au cœur de notre travail. » 

Lors de cette session, seront présentés les évidences et expériences pratiques d’investissement à succès dans le secteur, et ceci permettra d’ouvrir le dialogue entre les ministres, les responsables des agences de développement, les banques de développement, partenaires bilatéraux et multilatéraux, société civilee et secteur privé.";"Table Ronde avec un modérateur (8 min chaque panéliste)
-	Viceministre de Coopération (Ministère de l’Extériur): La grande Alliance entre le Fond de Coopération pour l’Eau et l’Assainissement en Amérique latine et les Caraîbes
-	Directeur Général de l’Eau  (MITERD): CODIA et l ’Initiative 5+5 en Méditerranée 
-	Commission europeénne: Team Europe et priorités en matière Eau et Assainissement 
-	CAF
-	BEI
-	SWA
-	CEO Secteur privé
-	Societé civile
-	Université
-	Débats entre les participants  
";ODD 6 | ODD 17 | alliances | coopération | secteur privé;Agencia Española de Cooperación Internacional para el Desarrollo (AECID). Agence de coopération au développement;90'
Panel de Haut Niveau;HLP22;Échange entre aquifères transfrontières de trois continents ;Lundi 21 mars de 14.00 à 15.30;Lundi 21 mars de 14.00 à 15.30;Salle 10;"Objectifs de la Session :
Etablir une dynamique d’échange d'expériences entre trois traités de gestion de trois aquifères transfrontières sur trois continents : premièrement les développements majeurs sur la gouvernance lors de ces deux dernières années sur l’aquifère sénégalo-mauritanien en Afrique deuxièmement les 40 ans d’expérience de l’aquifère du Genevois entre la France et la Suisse en Europe, et enfin les développements de la nappe du Guarani en Amérique du Sud. La session réunira des représentants des trois bassins sur ces aquifères pour échanger leurs expériences, les leçons apprises, des comités pertinents et d'autres arrangements institutionnels, le partage de données, la participation des parties prenantes et les opportunités de consolidation de la paix. On s'attend à ce que cette session marque le début d'une collaboration à plus long terme entre ces trois différents traités sur les aquifères transfrontières.
Cette session portera un focus particulier sur le BASM qui a eu des développements majeurs ces deux dernières années et notamment de joindre la gouvernance des eaux superficielles et les eaux souterraines.
";"Première partie approx 50’
?	La session s’ouvre avec un morceau/vidéo de la symphonie Voix du Fleuve voix de la paix. 2’
?	Présentation introductive par le Secrétaire Général. OMVG 2’
?	Mots d’introduction de ls Session des deux facilitateurs (GWH, UNECE,) 2’

?	Table ronde des aquifères transfrontières
o	Présentation BASM (Représentants du groupe de travail des quatre pays du BASM)
?	?	Prise de parole des représentants de Mauritanie, Sénégal, Guinée Bissau et Gambie – 12’ (3’/pers)
?	Les 2 Hauts commissaires des organismes de bassins transfrontières (OMVG et OMVS) présentent leur engagement sur la gestion de projet – 6’ (3’/pers)
?	Banque Mondiale son appréciation / intérêt du projet - 3’
?	UE 3’
?	Résumé facilitateurs - 3’

o	Présentation du Genevois
?	Présentation du Genevois 40 ans de coopération Directeur du projet - 5’
o	Présentation du Guarani 2 représentants de l’aquifère
?	Présentations des travaux et situation du développement du Guarani - 5’
o	Résumé du groupe facilitateur - 3’
2ième partie (approx 30’)
?	Table ronde Echange intercontinental d’expériences (Représentants du BASM, Guarani et Genevois, IGRAC, UNESCO, OSS)
o	Lancement de la Session UNESCO - 2’
o	Eléments à considérer dans cet échange BASM, Guarani et Genevois, et IGRAC -12’ (3’/pers)
o	Interaction avec le public conduit par UNESCO – 10’
o	Expériences et conclusion UNESCO et OSS – 4’ (2’/pers)
3ième partie conclusions approx 10’
Considérations des 4 ministres du Bassin Mauritanien-Sénégalais 8’ (2’ x4) 
 
";"Aquifères transfrontières | Bonne gouvernance et traités transfrontières | Sécurité de l’eau | Mise en valeur du Bassin de l’Aquifère Sénégalo-Mauritanien (BASM) | Gestion en commun des eaux souterraines et des eaux de surface | Leçons apprises et échanges d’expériences intercontinentaux 
";Geneva Water Hub AU NOM DE Ababacar Ndao, Secrétaire Général OMVG;90'
Panel de Haut Niveau;HLP23;Dialogue de haut niveau sur l'intégration de l'action climatique dans le secteur de l'eau;Jeudi 24 mars de 10.45 à 12.15;Jeudi 24 mars de 10.45 à 12.15;Room 9;""" Objectifs : 
- Partager les expériences, les stratégies et les instruments financiers disponibles pour faire face aux défis climatiques et à la sécurité de l'eau dans le secteur de l'eau ;
- Présenter les politiques, stratégies et plans des gouvernements traitant des questions nationales et transfrontalières liées à l'environnement, au climat et au développement qui affectent le secteur de l'eau ;
- Illustrer comment les BMD et les pays collaborent pour intégrer les mesures d'adaptation et d'atténuation du climat dans la planification du développement national, y compris dans le secteur de l'eau.

La session vise à répondre aux questions suivantes : 
- Quels sont les instruments financiers disponibles pour aider les pays membres de l'OCI à relever leurs défis d'adaptation et d'atténuation dans le secteur de l'eau ?
- Comment les partenaires du développement peuvent-ils soutenir les gouvernements aux niveaux régional, national et local pour faire face aux stress hydriques liés au climat dans les pays membres de l'OCI ?
- Comment les pays peuvent-ils s'adapter au changement climatique et l'atténuer tout en relevant les principaux défis de développement liés aux ODD dans le cadre du lien entre alimentation, énergie et eau ?

""";""" L'événement comprendra un panel de haut niveau informé par un rapport sur la situation et les défis de l'eau dans le monde islamique.
Il sera modéré par la BIsD. 
Après les remarques d'ouverture et la présentation, le modérateur posera des questions de cadrage et présentera chaque panéliste.
Proposition de programme :
- Remarques d'ouverture : BIsD, ICESCO, AIIB (15 mn)
- Présentation des résultats du rapport de l'OCI : La situation de l'eau et les défis dans le monde islamique, par le Dr Mazhar Hussain : Centre de recherche statistique, économique et sociale et de formation pour le monde islamique - SESRIC - Turquie (15 mn).

- Table ronde de haut niveau (50 millions d'euros) : Les panélistes proposés sont des responsables de la BIsD, de l'ISESCO et de l'AIIB, ainsi que des ministres chargés de l'eau ou du changement climatique.
""";Politiques nationales du secteur de l'eau | adaptation au changement climatique et atténuation de ses effets | sécurité de l'eau | financement innovant | contributions déterminées au niveau national.;Islamic Development Bank (IsDB), Multilateral Development Bank ;90'
Panel de Haut Niveau;HLP24;Nouvelles perspectives sur les sécheresses à l'heure du changement climatique;Mardi 22 mars de 10.45 à 12.15;Mardi 22 mars de 10.45 à 12.15;Salle 205;"Quelles sont les nouvelles perspectives sur la sécheresse à l'heure du changement climatique ? La sécheresse est souvent comparée à d'autres risques naturels tels que les inondations, les tempêtes et les incendies de forêt. Toutefois, contrairement à ces risques, la sécheresse est souvent un risque dit caché, ce qui signifie que son apparition n'est perçue que lorsque les conditions de sécheresse ont déjà un impact. 

Dans de nombreux pays du monde et en raison du changement climatique, les sécheresses deviennent plus sévères et ont des impacts négatifs plus importants et à grande échelle. De plus, l'incidence des vagues de chaleur sévères et de la sécheresse à court terme (sécheresses éclair) semble augmenter. L'objectif de la session est d'examiner l'évolution des sécheresses à l'heure du changement climatique et de voir comment cela peut changer nos perspectives pour faire face à ce problème croissant. 

Le discours d'ouverture présentera les différents types de sécheresses et la manière dont leur fréquence, leur ampleur et leur gravité évoluent en raison du changement climatique (évolution des sécheresses, leur définition et leur identification). Des représentants de différentes organisations internationales seront invités à présenter et à discuter des principes de gestion formulés pour guider et aider les décideurs à faire face aux sécheresses. Une attention particulière sera accordée à la nature intrinsèque de la sécheresse qui est transfrontalière (avec une attention particulière au rôle des eaux souterraines dans la gestion des sécheresses), intersectorielle et interinstitutionnelle. Le rapport du programme phare HELP sur la sécheresse sera également lancé au cours de l'événement. Il propose dix principes directeurs pour une gestion efficace de la sécheresse. Enfin, ces principes guideront la discussion avec les membres du panel. Les représentants régionaux et nationaux se pencheront sur ces principes et réfléchiront à ce qu'ils signifient concrètement pour leur propre pays et aux mesures à prendre pour faire face à l'ensemble des risques et des impacts associés aux cycles hydrologiques changeants et dynamiques. En reliant les principes recueillis à partir d'expériences dans le monde entier aux expériences locales, une interaction est lancée qui conduit à une influence mutuelle pour faire face aux développements que le changement climatique apporte. Il en ressortira des conclusions et des messages à emporter sur la manière dont le changement climatique influence les sécheresses, sur les mécanismes mis en place pour atténuer l'impact des sécheresses sur les moyens de subsistance et sur les mesures à prendre pour faciliter leur mise en œuvre.

La session s'adresse aux dirigeants et décideurs influents des gouvernements, des entreprises et de la société civile qui sont confrontés aux sécheresses.";"PROGRAMME FINAL 

Modérateur : M. Henk Ovink, Envoyé spécial pour les affaires internationales de l'eau, Ministère néerlandais des infrastructures et de la gestion de l'eau. 

5min - Mot de bienvenue, Dr. Han, Panel d'experts et de dirigeants de haut niveau sur l'eau et les catastrophes (HELP) 

10min - Discours principal de l'Organisation météorologique mondiale (OMM) 
M. Johannes Cullman, Directeur du Département du climat et de l'eau de l'Organisation météorologique mondiale à l'Organisation météorologique mondiale (OMM / IMDP) 

25min - Gestion efficace de la sécheresse pour les défis actuels et futurs : deux perspectives 
- Mme Chloë Oliver Viola, spécialiste principale en approvisionnement en eau et assainissement pour la pratique globale de l'eau du Groupe de la Banque mondiale
- M. Abou Amani, Directeur de la Division des Sciences de l'Eau, Secrétaire du Programme Hydrologique Intergouvernemental (PHI)

10min - Présentation du rapport phare HELP ""Principes directeurs pour la gestion du risque de sécheresse dans un contexte de changement climatique"".
M. Eelco van Beek, Conseiller expert chez Deltares
Vidéo et courte présentation soulignant les 12 principes directeurs développés dans le rapport comme un moyen efficace d'aborder ces nouvelles perspectives sur la sécheresse.

35min - Panel de discussion 
""Faire face à la sécheresse : comment traduire ces principes en actions au niveau local et régional ?""
- M. Harunobu Nagai, Directeur général adjoint, Département des ressources en eau, Bureau de la gestion de l'eau et des catastrophes, Ministère de la terre et de l'environnement. 
Bureau de la gestion de l'eau et des catastrophes, Ministère du territoire, des infrastructures, des transports et du tourisme du Japon. 
- Dr. Issoufou MAIGARY, Expert Hydrologue, Comité permanent inter-états de lutte contre la sécheresse dans le Sahel
- M. Tomás Sancho, Directeur adjoint des infrastructures et du domaine public hydraulique, Ministère espagnol de la transition écologique et du défi démographique.

5min - Clôture de la session ";Sécheresse | Impacts | Changement climatique | Gouvernance | Résilience;"Deltares (Research Institute) /
The Netherlands Ministry of Infrastructure and Water management ";90'
