Session spéciale;SS08;Trop petit pour économiser, trop grand pour faire des compromis ? Mesurer l'efficacité du financement de la gestion de la sécheresse au niveau communautaire;Mercredi 23 mars de 9.00 à 10.30;Mercredi 23 mars de 9.00 à 10.30;Salle 201;"Avec l'augmentation constante du flux de financement climatique des pays développés vers les pays en développement, il existe un besoin croissant de mesurer rigoureusement l'additionnalité à long terme, la cohérence et finalement les impacts sur les bénéficiaires finaux en termes réels. Accroître l'efficacité du financement de la lutte contre la sécheresse est d'un intérêt vital tant pour les partenaires financiers que pour les communautés, dont l'hétérogénéité inhérente et la diversité des besoins limitent l'harmonisation des mécanismes de financement et appellent des approches plus souples et innovantes. De nombreux mécanismes de financement du climat ont déjà introduit des méthodes pour évaluer leurs impacts. Cependant, les approches, les enregistrements et les données récupérées sur les résultats sont souvent inadaptés et insuffisants, et une meilleure compréhension de la situation actuelle est hautement souhaitable, afin de partager les leçons sur la mesure de l'efficacité.
L'événement parallèle contribue au débat mondial sur la mesure de l'efficacité du financement de la sécheresse du point de vue des utilisateurs finaux et comprend un ensemble cohérent de sessions, comme suit :
- Inventaire des acteurs financiers existants et des opérations publiques de financement du climat afin d'aligner les tendances désagrégées et le statut de l'atténuation et de l'adaptation à la sécheresse dans le financement du climat ;
- Analyse des approches de ciblage des investissements vers les plus vulnérables pour obtenir un impact à l'échelle, et des méthodes de mesure et de suivi des impacts de l'investissement ;
- Fournir des vitrines sur les conceptions d'investissements communautaires afin de soutenir l'évaluation de l'efficacité ;
- Discuter du potentiel des mécanismes de financement innovants pour soutenir la transition d'une assistance réactive et d'urgence vers un financement proactif et de préparation (par exemple, le financement basé sur les prévisions, le financement des risques, etc.)";"Remarques d'ouverture : Fonctionnaire de haut niveau (UA ?) - 5 mins
Discours d'ouverture : Représentant du gouvernement du pays bénéficiaire sélectionné - 10 min.
Table ronde : Panélistes attendus - 30 mins
Présentation : Représentant du pays bénéficiaire - 10 mins
Café du monde : Interview des représentants de la finance climatique par les médias - 20 minutes
Questions/réponses - 10 minutes
Mot de clôture - fonctionnaire de haut niveau (WWF9 ?) - 5 minutes";financement climatique | investissements innovants | adaptation et atténuation;FAO (International organization);90'
Session spéciale;SS09;Gestion Intégrée des Ressources en Eau (GIRE) dans les zones d’extraction minière en Afrique de l’Ouest;Mercredi 23 mars de 13.30 à 15.00;Mercredi 23 mars de 13.30 à 15.00;Salle 13;"Le développement de l’activité minière en Afrique de l’ouest est sans précédent depuis les années 2000. Les filières artisanales et semi-industrielles impliquent plus de 6 millions de personnes. Ce nombre augmente régulièrement. Des revenus importants sont perçus. Toutefois sont générés des tensions sociales et des impacts environnementaux considérables, déclinés à différentes échelles spatiales et temporelles, qu’il convient de mieux comprendre afin d’y apporter des solutions durables de maîtrise construites et acceptées par l’ensemble des acteurs. 
La gestion intégrée des ressources en eau des territoires miniers, ainsi que la qualité de l’eau, des effluents issus du traitement des minerais ou de l’exposition des déchets issus de l’activité minière active ou passée est un enjeu majeur de vie et de santé publique. Opérateurs privés, publics, collectivités, populations sont fortement concernés à l’échelle territoriale au-delà même du strict périmètre des zones exploitées. La construction de solutions viables pour adresser les problématiques complexes soulevées demande la mise en place de nouveaux paradigmes scientifiques, basés sur un dialogue multi-acteurs, pluri et interdisciplinaires, sur une recherche participative et sur une science ouverte et partagée.
Conduite en anglais et en français, l’objectif de cette table ronde sera d’aborder les problématiques, méthodologies, innovations et perspectives permettant de proposer des pistes de solutions viables, dont celles inspirées par la nature, pour mieux connaître, préserver ou restaurer les hydro-éco-systèmes, pour garantir une meilleure gestion quantitative et qualificative de la ressource « eaux » des bassins miniers en Afrique de l’Ouest et dans le contexte mondial des urgences et des transitions.
";"Une session de 90 minutes est proposée. Elle sera séquencée de la manière suivante: 

Session 1: Les grands enjeux scientifiques régionaux pour une GIRE dans les zones d’extraction minières en Afrique de l’ouest. 20 minutes d’échanges entre 4 intervenants et 10 minutes de questions/réponses. 

Cette première session aura pour objectif de cartographier des principaux sites miniers par type d’exploitation en Afrique de l’ouest et les impacts sur la ressource en eau. Il s’agira de présenter les principales problématiques de développement économique et humain associées. Le panel sera constitué de deux représentants des acteurs académiques (Harouna Karambiri - 2iE, Alphonse Yao - INPHB), d’une représentante des acteurs publics (Dr. DIENE SAMBA ROKHAYA, Directrice de la Géologie du Sénégal, un représentant d’un acteur privé BAMBA ZAKARI, ¨Président du Syndicat des producteurs miniers et acheteurs de l’UEMOA et d’un représentant de la société civile (à identifier). 
Session 2: Vers un dialogue multi-acteurs pluridisciplinaire. 20 minutes d’échanges entre 4 intervenants et 10 minutes de questions/réponses. 
Une deuxième session abordera la problématique du manque de dialogue entre acteurs impliqués dans la problématique et comment passer d’une organisation en silo à un dialogue multi-acteurs permettant la co-construction de pratiques et d’une réglementation adaptée aux contextes. Le panel sera constitué de M. Emile Kaboré (Chef de Division  mines et hydrocarbures de l’UEMOA), M. Lamine Seydou Traoré Ministre des mines, de l’eau et de l’energie  du Mali (à confirmer), de M. Felix Abagale (Directeur du centre d’excellence WACWISA UDS, Ghana), M. Daouda Mama (Directeur C2EA, Bénin) et d’un représentant d’une société minière (à identifier).  
Session 3: Présentations des solutions innovantes pour une meilleure GIRE en territoires miniers. 20 minutes d’échanges entre 4 intervenants et 10 minutes de questions/réponses. 
 Cette dernière session viendra clôturer notre session par une présentation concrète des solutions existantes pour une meilleure gestion des ressources en eau en territoires miniers. Ces solutions, basées sur la science, doivent être partagées, testées et mises à l’échelle pour atteindre nos objectifs de développement durable. Les panélistes seront M. Fabrice Colin (IRD), Mme. Diaka Sidibé (Ministre de l’enseignement supérieur et de la recherche de Guinée), M. Bernard Alando (CEA RWESCK), Mme. Marie Thérèse Laguerre (Véolia à confirmer).
";IWRM | mining | watersheds | restoration | South-South partnership;Institut de Recherche pour le Développement (IRD);90'
Session spéciale;SS10;Accélérer l'égalité des genres dans le domaine de l'eau : la voie à suivre;Mardi 22 mars de 13.30 à 15.00;Mardi 22 mars de 13.30 à 15.00;Salle 13;"L'analyse approfondie des réalisations et des défis liés au genre dans le domaine de l'eau, réalisée par le groupe de travail sur l'eau et le genre dirigé par le WWAP de l'UNESCO, indique clairement que, malgré les progrès réalisés au niveau des politiques internationales, la réalisation du droit fondamental à l'égalité des sexes dans le domaine de l'eau et de l'assainissement n'est pas en bonne voie. Les femmes restent sous-représentées en matière d'emploi et de participation à la prise de décision à tous les niveaux dans le domaine de l'eau. À huit ans de la date butoir de l'Agenda 2030 pour le développement durable, il est urgent de prendre des mesures concrètes, audacieuses et ambitieuses.

La réalisation de progrès vers l'égalité des sexes dans le domaine de l'eau nécessite des connaissances solides, des solutions pratiques et une action collaborative. Le WWAP de l'UNESCO, en collaboration avec une coalition multipartite comprenant des institutions des États membres, des organisations internationales et régionales, des universités et des ONG, mène un appel mondial à l'action pour accélérer les progrès vers l'égalité des sexes dans le domaine de l'eau et construire des sociétés justes et résilientes. 

Cette session spéciale présente les efforts déployés sur le terrain pour atteindre l'objectif commun et combler le manque de données dans le secteur de l'eau en vue de l'égalité des sexes. Mobilisés par l'initiative ""Call for Action"", un certain nombre d'organisations et d'experts discuteront des stratégies et des bonnes pratiques pour surmonter les défis persistants liés au genre dans le domaine de l'eau. De même, la session explorera comment les décideurs de différentes régions du monde abordent les inégalités entre les sexes dans la gouvernance de l'eau et dans la gestion intégrée et adaptative de l'eau, et partagera des connaissances sur les approches visant à accroître la résilience et l'inclusion des membres de la communauté.";"Mots de bienvenue (5 min)
Directrice du WWAP de l'UNESCO, Michela Miletto - Introduction à l'appel à l'action

Membres de la Coalition multi-acteurs : soutien à l'Appel à l'action et introduction aux célébrations à mi-parcours de la Décennie internationale de l'eau 2023 (20 min)
o Slovénie - Borut Pahor, Président 
o Pays-Bas - Kitty van der Heijden, directrice générale de la coopération internationale, ministère des Affaires étrangères
o Tadjikistan - Sirojiddin Muhriddin, ministre des Affaires étrangères
o Italie - Marina Sereni, vice-ministre des affaires étrangères et de la coopération internationale 

Membres de la Coalition multipartite : perspectives nationales (50 min)

Panel 1 : De meilleures données pour des décisions mieux informées sur l'eau (20')
o Argentine - María Eugenia Vargas Zambrano, Chef de la Commission Genre, COHIFE (Consejo Hidrológico Federal) 
o Costa Rica - Plan pilote pour désagréger les données statistiques nationales sur l'eau par sexe - Vivian Gonzalez Gimenez, Directeur des projets et des processus stratégiques, Ministère de l'eau et de l'énergie
o Liberia - (à confirmer)
o Banque mondiale - Karin Krchnak, gestionnaire de programme, groupe Ressources en eau 2030 / ou / Kamila Galeza, spécialiste du développement social, Groupe de la Banque mondiale 

Panel 2 : Politiques et programmes qui fonctionnent sur le terrain - Expériences régionales des politiques de l'eau et du genre (30')
o AMCOW - Comfort Kanshio, Agent de soutien ASPG et Point Focal Genre - L'intégration du genre et la politique de la jeunesse
o Banque asiatique de développement - Renforcement des pratiques WASH et changement de comportement en matière d'hygiène dans le Pacifique / Organisation régionale, Vivian Castro-Wooldridge
o Réseau méditerranéen des jeunes pour l'eau, Mme Fatine Ezbakhe, coordinatrice 2020-2022 / ou / WSP 
o WIWAS - Soutien aux femmes professionnelles des services de l'eau en Afrique - Mme Leunita Sumba, Présidente
o Côte d'Ivoire - Mme Euphrasie Kouassi Yao, Conseillère du Président sur les questions de genre, ancienne ministre 
o AFD (Agence Française de Développement) - Mme Céline Gilquin, Chef de service eau et assainissement 

  
Questions et réponses (15 min)";Genre | égalité | autonomisation des femmes | gouvernance de l'eau | action;UNESCO WWAP, Intergovernmental Organization;90'
Session spéciale;SS11;Questions transversales dans les domaines thématiques;Jeudi 24 mars de 9.00 à 10.30;Jeudi 24 mars de 9.00 à 10.30;Salle 12;Cette session se penche sur les solutions transversales qui traversent les domaines thématiques et génèrent un dialogue multidisciplinaire entre les domaines disciplinaires autour de l'eau. ;"vue d'ensemble - 5 min
brèves interventions des co-présidents - 30 min  
discussion modérée - 30 min 
résumé et voie à suivre - 15 min ";Sécurité de l'eau | climat | développement rural | sécurité alimentaire | Nexus ;WWC;90'
Session spéciale;SS12;Solutions méditerranéennes issues du 4ème forum Méditerranéen de l'eau, Malte, déc 2021;Jeudi 24 mars de 13.30 à 15.00;Jeudi 24 mars de 13.30 à 15.00;Salle 12;"Véritable plateforme d’échange et de consolidation du savoir-faire et des expériences dans le domaine de l’eau en Méditerranée, le 4ème forum méditerranéen de l’eau organisé à Malte en décembre 2021 a permis d’identifier des réponses efficaces à même de garantir la sécurité en eau. Ce thème est d’une importance cruciale pour la Méditerranée où les changements démographiques, les défis socioéconomiques et les effets du changement climatique ne cessent de menacer la sécurité de l’eau. Le processus méditerranéen tentera.
Sur la base d’échanges d’expériences durant le forum de Malte, les meilleures pratiques et technologies développées ont été identifiés pour être présenter comme réponses aux défis liés à la sécurité de l’eau dans la région et au-delà parmi lesquelles :
a)	Des solutions d'eau inspirées de la nature régénératrice avec des modèles d'exploitation innovants. 
b)	Un outil de suivi de l'efficacité hydraulique, proposant un audit et une amélioration de la performance hydraulique des systèmes d'approvisionnement en eau potable.
c)	La conciliation de la croissance industrielle avec la préservation des ressources en eau à travers la mise place d’un programme « Economie Circulaire basé sur une stratégie d’optimisation de la consommation et le recours aux eaux non conventionnelles 
d)	Guide méthodologique d’une démarche d’assistance technique aux périmètres irrigués par les eaux usées traitées
e)	Observatoire mondial des ressources en eau non conventionnelles et des énergies renouvelables associées dont le but est de compléter le travail des institutions en apportant des expériences de recherche et d'application à un public plus large.";"13:30- 13:35	Mot de bienvenue par M. Alain Meyssonnier, Président de l’Institut Méditerranéen de l’Eau (IME)
13:35-13:40	Propos introductif par M. Almotaz Abadi, Directeur Général au Secrétariat de l’Union pour la Méditerranée (UPM)
13:40-13:50	Retour sur le 4ème Forum Méditerranéen de l’Eau de Malte par M. Alain Meyssonnier (IME) et M. Almotaz Abadi (UPM)
13:50-14:20	Solutions innovantes issues du Forum de Malte :
•	Zineb Benjelloun, OCP Maroc, « Les défis de l’eau vus par un industriel »
•	Maha Alsalehi, EMWIS, « Projet HYDROSA »
•	Michel Nalbandian, Eaux de Marseille Maroc, « Audit et amélioration de la performance hydraulique des systèmes d'approvisionnement en eau potable »
•	Octavi Quintana, PRIMA “Coopération internationale” (tbc)
•	Représentant AECID, “Financement du secteur de l’eau” (tbc)
14:20-14:35	Débat (Q/R)
14:35-14:45	Synthèse de la session méditerranéenne par Mme Charafat Afailal, ancienne Ministre en charge de l’eau du Gouvernement marocain
14:45-14:50	Conclusion par M. Moez Allaoui, Directeur de la Société Nationale d’Exploitation et de Distribution des Eaux de Tunisie (SONEDE)
14:50-15:00	Mot de clôture par M. Loïc Fauchon, Président du Conseil Mondial de l’Eau (CME)

";MEDITERRANEE | INNOVATIONS | EAU | PLATEFORME | COOPERATION;INSTITUT MEDITERRANEEN DE L'EAU;90'
Session spéciale;SS13;Observatoire international des ressources en eau non conventionnelles et énergies renouvelables dédiées;Jeudi 24 mars de 9.00 à 10.30;Jeudi 24 mars de 9.00 à 10.30;Salle 201;"Le pourtour de la Méditerranée et le Sahel font partie des régions du globe les plus pauvres en eau douce et les conduit à utiliser d’autres types d’eau que les lacs, rivières et aquifères, et qui sont donc appelés ressources en eau non conventionnelles : les eaux usées qui sont traitées pour être réutilisées, les eaux salées ou marines qui sont dessalées. Ces mobilisations se développent rapidement compte tenu de la démographie et du réchauffement climatique, mais au prix de consommations énergétiques en forte augmentation qui vont à l’encontre des objectifs climatiques.
L’information sur ce sujet en pleine évolution est incomplète, non actualisée, non validée et non partagée malgré les inventaires d’Aquastat, de Desaldata ou de l’IRENA. Des organismes internationaux tels que AFD, BERD ou AIE engagent des dépenses significatives pour des études qui ne fournissent qu’une photographie partielle et ponctuelle de la situation.
Grâce à son réseau professionnel et à ses partenaires, l’IME a identifié une forte attente des acteurs de l’eau et de l’énergie (planificateurs, concepteurs, constructeurs, exploitants, chercheurs etc.) vis-à-vis d’un observatoire international qui rassemblerait et rendrait accessibles des informations sur ce thème (indicateurs, cartes, installations, projets, experts, réglementation etc.) tout en permettant des échanges dynamiques entre pays. Le partage d’expériences mettrait ainsi à disposition les meilleures pratiques ou innovations dans le domaine technique, économique ou social, seules capables d’atteindre les ODD. Le lancement de cet observatoire est possible grâce au projet préparé par l’IME et dont un prototype réalisé par un groupe de pays seront montrées à Dakar.";"
9:00-9:10	Discours d’ouverture par M. Alain Meyssonnier, Président de l’Institut Méditerranéen de l’Eau (IME)
9:10-9:15	Propos introductif par M. Almotaz Abadi, Directeur Général au Secrétariat de l’Union pour la Méditerranée (UPM)
9:15-9:30	Présentation de l’étude de faisabilité et ses recommandations par les groupes d’experts IME :
•	M. Mokhtar Bzioui, Président du Comité Scientifique et Technique de l’IME
•	M. Mohammed El Ghali Khiyati, Expert REUSE
9:30-10:10	Activités en cours, en tant que prototype du future Observatoire par les Pays et Partenaires :
•	Représentant du Ministère espagnol de la Transition Ecologique et du Défi Démographique (tbc)
•	Mme Latifa Dhaouadi, IME & Mme Paola Pommier, SCP « Guide méthodologique pour la mise en œuvre des projets pilotes REUSE » (tbc)
•	M. Rifaat Abdelwahab, HCWW Egypte
•	M. Mohammed Bany-Mustapha & M. Issa Al-Wer, Ministère de l’Eau et de l’Irrigation, Jordanie
•	M. Khaled Zaabar, SONEDE Tunisie
10:10-10:25	Débat (Q/R)
10:25-10:30	Conclusion par M. Loïc Fauchon, Président du Conseil Mondial de l’Eau M. Alain Meyssonnier, Président de l’Institut Méditerranéen de l’Eau (IME)

";OBSERVATOIRE | EAUX NON CONVENTIONNELLES | ENERGIES RENOUVELABLES;INSTITUT MEDITERRANEEN DE L'EAU, ONG;90'
Session spéciale;SS14;Améliorer la gouvernance de l'eau : de la connaissance à l'action;Jeudi 24 mars de 13.30 à 15.00;Jeudi 24 mars de 13.30 à 15.00;Salle 202;"Cette session a pour but d'explorer des moyens innovants de générer et de partager des connaissances pratiques sur la gestion intégrée des ressources en eau (GIRE) entre un large éventail de parties prenantes à travers les secteurs et les échelles. Elle mettra en lumière des solutions concrètes en matière d'eau et de climat apportées par différents groupes qui se sont avérées durables dans les pays et les secteurs où elles ont été mises en œuvre (par exemple, en matière de sécurité alimentaire, d'inclusion sociale, de coopération transfrontalière, etc.) ). De manière interactive, elle disséquera certains de ces cas pour permettre aux participants de parvenir à des conclusions et des recommandations communes. 

La session marquera également le lancement mondial de la boîte à outils GWP : IWRM Action Hub qui, en plus d'offrir la sélection la plus complète au monde de ressources de connaissances sur la GIRE (90 outils, 250 études de cas et 2500 ressources), servira également de centre de connexion pour les professionnels de l'eau qui pourront se connecter et échanger dans les communautés de pratique hébergées dans l'ActionHub. Les participants auront l'occasion d'améliorer leurs connaissances grâce à des conseils pratiques et des activités concrètes au sein de nos différentes communautés.  

Le GWP et l'OMM lanceront également conjointement un nouveau défi/concours pour des solutions innovantes de la connaissance à l'action (K2A) contribuant à l'adaptation au climat et à l'atténuation de ses effets, qui seront directement soumises et présentées sur l'IWRM ActionHub. Plutôt que de se concentrer sur les approches technologiques et scientifiques, ces solutions doivent clairement mettre en évidence la façon dont elles favorisent le changement systémique pour devenir plus sûrs en matière d'eau et de climat.  ";"Partie 1 : De la connaissance à l'action 
Présentations d'initiatives créatives et de solutions innovantes - 15 min (5 présentations x 3 min chacune) 
Discussion en cercle avec les présentateurs - 15 min 

Partie 2 : Pourquoi des communautés de pratique ? 
Partage d'expérience et exercice pratique : Communautés de pratique du centre d'action de la GIRE - 20 min (4 communautés de pratique x 5 min chacune)  
Ce qui fait une bonne communauté de pratique : Réflexions - 10 min 

Partie 3 : Lancement du concours 
Préparer le terrain - 5 min 
Exercice de co-création avec les participants : identification des domaines prioritaires pour le concours en utilisant le cadre d'action du 9ème Forum mondial de l'eau - 20 min 
Lancement officiel du concours innovant Knowledge to Action (K2A) - 5 min "; Prise de décision basée sur les données | solutions pratiques | alliances de connaissances | coopération triangulaire | communautés de pratique ;Global Water Partnership;90'
Session spéciale;SS15;Le Développement rural  pour renforcer la résilience face aux changements globaux;Jeudi 24 mars de 13.30 à 15.00;Jeudi 24 mars de 13.30 à 15.00;Salle 10;"La raréfaction des ressources   en eau  est un phénomène qui s’intensifie de plus en plus sous l’effet, de la forte pression sur l’eau et le changement du climat impactant  principalement, les communautés rurales les plus vulnérables. Ces dernières sont dépendantes de la ressource hydrique dans leurs activités socio économiques. 
De plus, les besoins réels de la population rurale vulnérable ne sont pas réellement pris en compte et suffisamment représentés, lors de la prise de décision concernant les projets d’investissement hydro-agricoles et de développement des territoires. 
Aussi, cette session thématique spéciale a pour objectif, de mettre l’accent sur la nécessité d’assurer un développement rural tenant compte des besoins réels des populations  vulnérables, souvent incapables de faire face aux changements globaux. 
Elle permettra également :
?	De présenter les programmes et les stratégies sectorielles du Maroc visant le renforcement de la résilience des populations face aux aléas du climat  (le programme d’Approvisionnement en eau potable et d’irrigation 2020-2027,  la stratégie Génération Green 2020-2030, plan national d’aménagement des bassins versants, INDH……)
?	De mettre l’accent sur la nécessité d’améliorer la gestion de l’eau à l’échelle locale, afin de contribuer au renforcement de la résilience de la population rurale, améliorer leurs conditions de vie et réduire leur niveau de pauvreté.
?	De présenter de bonnes pratiques de conservation de l’eau et des sols";Programme en cours d'élaboration en coordination avec les partenaires   ;"Le renforcement de la résilience des populations  face à la variabilité des ressources en eau | La mise en place d’infrastructures (lacs collinaires, petits barrages, seuil de rétention d’eau pour la conservation de l’eau et des sols | L’Augmentation de  la productivité de l’eau  à travers la mise à l’échelle  de bonnes pratiques agricoles

";Ministère de l'Equipement et de l'Eau/Direction Générale de l’Eau ;60'
