Type de session;Session code;Titre de la session;Date et heure de la session;Date et heure de la session2;Salle;Description de la session;Programme de la session;Mots cles;Organisateurs;Duree de la session
Panel de Haut Niveau;HLP01;Rendre visible l’invisible : les eaux souterraines, une réponse pour la résilience et la durabilité;Mardi 22 mars de 9.00 à 10.30;Mardi 22 mars de 9.00 à 10.30;Auditorium;Le panel de haut niveau (HLP) est destiné à être un événement de suivi après la session plénière de la célébration de la Journée mondiale de l'eau 2022 organisée par l'UNESCO et UN-WATER sur le thème de la Journée mondiale de l'eau - Les eaux souterraines : Rendre l'invisible visible. Le panel HLP permettra d'organiser un débat plus large et approfondi sur le Rapport de Développement des Nations Unies 2022 qui sera présenté le 21 mars à l'ouverture avec la participation de représentants de pays et d'experts de haut niveau.  Le HLP a pour but de discuter de la façon dont les eaux souterraines peuvent être une réponse aux défis de la sécurité de l'eau. Une attention particulière sera accordée à la mise en œuvre du Cadre mondial d'accélération du SDG6. Les principales conclusions du HLP seront examinées lors du Sommet de l'ONU sur les eaux souterraines, qui sera organisé les 7 et 8 décembre 2022 au siège de l'UNESCO, et constitueront un moyen de mettre l'accent sur les eaux souterraines lors de la conférence de l'ONU sur l'eau de 2023. Le HLP mettra l'accent sur les investissements dans les eaux souterraines en Afrique et dans les PEID et examinera comment les eaux souterraines offrent une voie potentielle pour soutenir les activités humaines et la santé des écosystèmes, avec un accent particulier sur l'Afrique et les PEID.  L'Afrique, le continent le plus jeune, a plus que tout besoin d'une attention particulière pour les eaux souterraines, afin de garantir la sécurité de l'eau pour les générations futures.  Il existe 72 aquifères transfrontaliers en Afrique, qui représentent un potentiel pour le développement socio-économique de la région.;"""Ce HLP est un suivi de la session plénière de la célébration de la Journée mondiale de l'eau de l'ONU. Les représentants de haut niveau des pays et les experts invités feront des déclarations, des présentations et des débats dans une modalité de panel. 

Modérateur : Mme Alice Aureli, UNESCO 
5'-Président : M. Nabil Ben Khatra, Secrétaire exécutif, Observatoire du Sahara et du Sahel (OSS)

 Déclarations de haut niveau
- 5' M. Jean Paul Adam, Directeur Changement climatique, gestion des ressources naturelles et technologie, Commission économique des Nations Unies pour l'Afrique
- 5' M. Sekou Sangare, Commissaire, Communauté Economique des Etats de l'Afrique de l'Ouest (CEDEAO) 
 
Présentations (15') 
Le PAM CEDEAO sur les eaux souterraines. Un exemple réussi de coopération scientifique : Un nouvel outil pour rendre visible la gestion des eaux souterraines. 
- M. Alexis Gutierrez, Service Géologique Français (BRGM), M. Stefan Broda, Institut Fédéral des Géosciences et des Ressources Naturelles, Allemagne (BGR), Mme Brighid O Dochartaigh, British Geological Survey (BGS)
- Mme Jodie Miller, Agence internationale de l'énergie atomique (AIEA)

5' Déclaration : Mme Eugénie Avram, Ministère de l'Europe et des Affaires étrangères de la France
 
Présentations 
- 5' Mme Sonja Koppel, Secrétaire de la Convention sur l'eau, Commission économique des Nations Unies pour l'Europe (UNECE) et M. Aurélien Dumont, Chargé de projet, Programme hydrologique intergouvernemental (UNESCO PHI). Coopération en matière d'aquifères transfrontaliers - les principaux résultats de l'indicateur 6.5.2. de l'ODD 6.  
- 5' Mme Karen Villholth, Coordinatrice GRIPP (IWMI), Aquifères transfrontaliers. 
5' Déclaration : S.E. Shawn Richards - Ministre de l'infrastructure publique et du développement urbain du gouvernement de St. Kitts et Nevis - Les eaux souterraines dans les petites îles (Vidéo)

Panel d'experts   
Modérateurs : Mme Neno Kukuric (IGRAC) et Mme Michela Miletto (UNESCO WWAP)

Panélistes :  (35')
1.	Mme Concepcion Marcuello, Ministère de la Transition Ecologique de l'Espagne 
2.	M. Gérard Payen, Vice-président, Partenariat Français pour l'Eau (FWE)
3.	Mme Dominique Darmendrail, Directrice de programme Eau (BRGM)
4.	M. Eddy Moors, Recteur, IHE Delft Institute for Water Education, Pays-Bas
5.	Banque mondiale ?
6.	M. Abdelkader Dodo, Coordinateur du Département de l'eau, (OSS)
7.	Mme Maria Salvetti, Economiste et analyste des politiques de l'eau, (OCDE)  

Remarques finales
Participation des jeunes/jeunes professionnels
Mme Alice Aureli, UNESCO PHI 

""";Eaux souterraines | Cadre d'accélération de l'ODD 6 | Résilience | Coopération | Afrique ;UNESCO Intergovernmental Hydrological Programme (UNESCO-IHP);90'
Panel de Haut Niveau;HLP02;Financement de la paix bleue : L'initiative de financement de la paix bleue - Comment investir dans la paix par l'eau;Lundi 21 mars de 14.00 à 15.30;Lundi 21 mars de 14.00 à 15.30;Salle 205;"En 2017, le Groupe mondial de haut niveau sur l'eau et la paix a lancé son rapport ""Une question de survie"" avec des recommandations sur la manière de promouvoir l'eau en tant qu'instrument de coopération et de paix, notamment par le biais de financements innovants pour la coopération dans le domaine de l'eau. Lors de la 9e session (2021) de la réunion des parties à la Convention sur l'eau de 1992, la Commission économique des Nations unies pour l'Europe (CEE-ONU) a lancé la publication intitulée ""Funding and Financing transboundary water cooperation and basin development"" (Financement de la coopération en matière d'eau transfrontalière et du développement des bassins), présentant également des initiatives de financement innovantes, notamment l'initiative de financement de la paix bleue.  Créée conjointement par les organismes de bassin, la Direction suisse du développement et de la coopération (DDC), le Fonds d'équipement des Nations unies (FENU) en tant que principale agence de mise en œuvre et d'autres parties prenantes, l'initiative de financement Blue Peace combine des financements publics et privés pour développer et mettre en œuvre des plans directeurs et d'investissement conjoints transfrontaliers. Elle favorisera l'accès aux capitaux publics et privés pour les organisations transfrontalières (par exemple, les organismes de bassins fluviaux (OBF)). L'objectif principal de ce panel de haut niveau (HLP) sera de lancer l'initiative de financement de la paix bleue, en montrant comment des mécanismes de financement innovants peuvent transformer l'eau en un instrument pour des cadres de coopération transfrontaliers, multisectoriels et intergénérationnels, menant à des sociétés pacifiques et des économies circulaires. 
Résultats : Il fournira une nouvelle incitation financière aux pays et aux secteurs pour coopérer et établir des accords politiques sur la gestion durable des ressources partagées, en réduisant les risques et les conflits sociaux, politiques, économiques et environnementaux. Dans le même temps, il modifiera la perception de l'eau par le secteur financier, non pas comme un secteur distinct, mais comme un point d'entrée pour des opportunités d'investissement à impact multisectoriel et régional.";"Session d'ouverture :
'- Ouverture et modération : Mme Preeti Sinha, Directrice exécutive, Fonds d'équipement des Nations Unies (FENU) - 5'.
'- Discours d'ouverture :  Mme Amina Mohammed, Secrétaire générale adjointe de l'ONU - 5'.
'- Lancement de l'initiative de financement Blue Peace : David Jackson, Directeur Local Transformative Finance Practice (LTFP), FENU - 5'

Interventions du panel : 
'- Défis et opportunités du financement des projets d'eau transfrontaliers : Haut-Commissaire, Elhadj Lansana Fofana ou Secrétaire général Ababacar Ndao, Organisation pour le développement du bassin du fleuve Gambie (OMVG) - 5'
'- Point de vue d'un Etat souverain sur le financement de la coopération en matière d'eau transfrontalière : S.E. M. Njie, Ministre des Finances et des Affaires économiques, Gambie - le point de vue d'un Etat souverain - 5'.
'- Le point de vue d'un Etat souverain sur le financement de la coopération en matière d'eau transfrontalière : S.E. M. M. Bessler, Secrétaire d'Etat, Suisse - le point de vue d'un Etat souverain - 5'.
'- Genèse de l'initiative Blue Peace Finance : Dr. Danilo Türk, Ancien Président de la République de Slovénie et Président du Panel Mondial de Haut Niveau sur l'Eau et la Paix - 5'

Débat d'experts : 
'- Perspective du secteur financier : Panélistes et représentants du secteur financier - 30'.
'- Questions et réponses - 15'.

Séance de clôture :
'- Résumé et remarques de clôture (FENU et/ou OMVG) - 10'. 
";"Coopération transfrontalière dans le domaine de l'eau | L'eau et la paix | Financement innovant | Cadres de coopération multipartites, inclusion des communautés et des gouvernements locaux
Investissement à impact  
";United Nations Capital Development Fund (UNCDF);90'
Panel de Haut Niveau;HLP03;Panel international de haut niveau pour les investissements dans le secteur de l'eau en Afrique : Débloquer des financements pour des projets d'eau résilients au climat;Mercredi 23 mars de 9.00 à 10.30;Mercredi 23 mars de 9.00 à 10.30;Auditorium;"Le 12 août 2021, AMCOW, en collaboration avec le PNUD, l'UNICEF, l'AUDA-NEPAD, la BAD, la GCA et le GWP, a lancé un partenariat pour organiser un Panel international de haut niveau sur l'investissement dans l'eau en Afrique. 

Le 8 septembre 2021, le Comité exécutif de l'AMCOW a salué les efforts des organisateurs et a officiellement adopté une décision pour l'inauguration du Panel.  

L'objectif du Panel est d'élaborer un rapport et un plan d'investissement de haut niveau pour la Conférence des Nations Unies de 2023 et les chefs d'État de l'Union africaine, avec une recommandation claire pour les pays africains sur la façon de mobiliser 30 milliards de dollars par an pour combler le déficit d'investissement dans l'eau en Afrique, qui est estimé à 45-54 milliards de dollars par an. 

L'événement HLP communiquera sur la manière dont le panel peut accélérer la transformation requise pour augmenter le financement de la sécurité de l'eau en Afrique et présentera des initiatives ambitieuses pour accélérer les investissements dans l'eau résiliente au climat en Afrique - comme le Programme continental d'investissement dans l'eau en Afrique (AIP) dont l'objectif est de mobiliser 30 milliards de dollars d'investissements dans l'eau résiliente au climat d'ici 2030 ; ainsi que le Programme d'accélération de l'adaptation en Afrique (AAAP) qui vise à mobiliser 25 milliards de dollars d'ici 2025 et à galvaniser les actions résilientes au climat par le biais d'une approche à triple gain pour faire face aux impacts de Covid-19, du changement climatique et de l'économie. 

Objectifs de l'événement :

1.	Présenter le Panel international de haut niveau sur les investissements dans le secteur de l'eau en Afrique et explorer les perspectives pour accélérer le financement à grande échelle des investissements dans le secteur de l'eau.
2.	Présenter les organisateurs du Panel international de haut niveau sur les investissements dans le secteur de l'eau et présenter les initiatives nouvelles et en cours liées à l'eau et résilientes au climat afin de mobiliser des investissements et des financements.
";"En fonction des orateurs confirmés, l'ordre du jour proposé pour la session est le suivant :
 
5 min M. Henk Ovink - Envoyé spécial pour les affaires internationales de l'eau, Royaume des Pays-Bas
- Bienvenue, introduction, objectif du Panel international de haut niveau sur les investissements dans le secteur de l'eau en Afrique.

10 mins S.E. le Président Jakaya Kikwete, ancien Président de la Tanzanie, Président de la Coordination Afrique du GWPSA. 

- Quel changement doit avoir lieu pour créer les conditions d'une augmentation des investissements et du financement des investissements dans l'eau résiliente au climat en Afrique ? 

5 mins S.E. Dr. Ibrahim Mayaki, PDG, Agence de développement de l'Union africaine (AUDA-NEPAD) 
 
- Le 7 février 2021, l'Assemblée des chefs d'État et de gouvernement de l'Union africaine a adopté le Programme continental d'investissement dans l'eau en Afrique (PIA) afin d'accélérer les investissements dans l'eau transfrontalière en Afrique. Quelles sont les opportunités pour le Panel de Haut Niveau de mobiliser des financements pour les projets d'eau du PIDA ?

5 mins Hon. Carl Hermann Gustav Schlettwein, Président : AMCOW

- Le 8 septembre 2021, le Comité exécutif de l'AMCOW a adopté une décision pour la création d'un Panel international de haut niveau pour l'Afrique.  Comment ce panel bénéficiera-t-il aux efforts de l'Afrique pour mobiliser des investissements pour la sécurité de l'eau ?

5 mins Représentant senior du GCF 

- Les projets axés sur l'eau représentent près de la moitié du financement de l'adaptation au changement climatique, mais comme le financement de l'atténuation dépasse de loin celui de l'adaptation, le total des flux de financement du changement climatique destinés aux initiatives dans le domaine de l'eau s'élève à moins de 3 %. Comment pouvons-nous changer cela ? 

5 mins Prof. Dr. Patrick V. Verkooijen, CEO : GCA 

- Le 6 septembre 2021, avec Ban Ki-moon, 8ème Secrétaire Général des Nations Unies, le Président du Conseil d'Administration de la GCA, Kristalina Georgieva- Directrice Générale du Fonds Monétaire International, vous avez réuni plus de cinquante leaders mondiaux pour accélérer l'impératif d'adaptation pour la COP 26. Quels ont été les messages clés des dirigeants et comment le Groupe de haut niveau peut-il en tirer parti pour mobiliser des fonds pour l'adaptation de l'eau ?

5 mins Dr. Pradeep Kurukulasuriya, Coordinateur exécutif et Directeur : PNUD

- Le portefeuille de résilience climatique du PNUD en Afrique s'élève à plus de 1,2 milliard de dollars US. Comment le Panel peut-il tirer parti du portefeuille du PNUD pour mobiliser des financements à grande échelle pour l'adaptation liée à l'eau en Afrique ?

5 mins Mme Kelly Ann Naylor, Directrice, Eau Assainissement Hygiène : UNICEF

- L'UNICEF, en association avec le Partenariat mondial pour l'eau (GWP), a développé le Cadre stratégique pour un développement résilient au climat dans le domaine de l'eau, de l'assainissement et de l'hygiène. Ce cadre a été utilisé par plus de 80 pays. Comment le Panel de haut niveau peut-il en tirer parti pour augmenter les investissements en faveur d'un développement WASH résilient au climat en Afrique ?

5 mins Dario Soto-Abril, PDG : Global Water Partnership 

- Global Water Partnership soutient activement l'objectif du PIA de mobiliser 30 milliards de dollars par an d'investissements dans le domaine de l'eau résiliente au climat en Afrique d'ici 2030 et de créer 5 millions d'emplois. Pourquoi le PIA offre-t-il un nouvel espoir pour l'Afrique et quelles sont les opportunités qu'il offre pour le Nord ? 

5 mins Osward Chanda, Directeur Ag, Eau et Assainissement, Banque Africaine de Développement
- Le Conseil d'administration du Groupe de la Banque africaine de développement a récemment approuvé une nouvelle politique de l'eau, donnant la priorité à la sécurité de l'eau et à la transformation des actifs hydriques pour favoriser une croissance économique durable, verte et inclusive dans les pays membres régionaux. Comment les pays et le Panel de haut niveau peuvent-ils tirer parti de cette politique et mobiliser des investissements à grande échelle ?

3 mins Court interlude vidéo/présentation

25 minutes Discussion avec l'auditoire

5 minutes Résumé des messages clés, feuille de route pour le Panel international de haut niveau sur les investissements dans le secteur de l'eau. 
- Alex Simalabwi, Secrétaire exécutif, GWPSA-Afrique, Chef du Secrétariat conjoint du Panel 

2 mins Le modérateur remercie les intervenants, conclut et clôture l'événement
- Henk WJ Ovink-Envoyé spécial pour les affaires internationales de l'eau, Royaume des Pays-Bas
";"Investissements dans l'eau en Afrique ; PIA ; Panel de haut niveau sur l'eau";Global Water Partnership;90'
Panel de Haut Niveau;HLP04;Leaders de la coalition pour l'eau et le climat - Des paroles aux actes;Mercredi 23 mars de 10.45 à 12.15;Mercredi 23 mars de 10.45 à 12.15;Salle 12;"Le changement climatique exacerbe à la fois la pénurie d'eau et les risques liés à l'eau, car la hausse des températures perturbe le régime des précipitations et l'ensemble du cycle de l'eau. On estime que 80 % des effets du changement climatique sont ressentis à travers l'eau et la crise ne fera que s'intensifier à l'avenir. 

Lors de la conférence des Nations unies sur le changement climatique (COP26), les dirigeants de la coalition Eau et Climat ont lancé un appel urgent et uni en faveur d'une action intégrée pour l'eau et le climat, afin de remplacer l'approche actuelle, fragmentée et axée sur la crise. 

Lors de cette session, les leaders de la coalition pour l'eau et le climat fourniront des conseils stratégiques sur l'intégration des agendas de l'eau et du climat (y compris l'Agenda 2030 des Nations Unies, le Cadre de Sendai, l'Accord de Paris et l'Agenda 2063 de l'Afrique), afin de maximiser les synergies dans la conception et la mise en œuvre des actions visant à atteindre les ODD 6 et 13. 

Ils présenteront en outre les six résultats concrets suivants, qui seront proposés lors de la conférence de la Décennie des Nations unies pour l'eau en 2023, et en discuteront avec le public : 

- Un système d'observation de l'eau connecté au niveau mondial 
- une nouvelle logique de financement qui tient compte des avantages sociétaux et de la durabilité écologique dans le développement de l'eau et du climat 
- un cadre explicite de coopération entre les bassins fluviaux pour évaluer et partager les avantages des activités d'adaptation et d'atténuation des effets de l'eau sur le climat 
- Un processus et une plateforme en libre accès qui font le point sur les activités liées au climat et à l'eau.
- une année internationale de la préservation des glaciers en 2025 et un mécanisme international pour faciliter l'accès à des informations précises et actualisées sur la cryosphère
- une méthodologie et un processus permettant de catalyser un changement réel sur le terrain.";"Au cours de l'événement, les participants du WWF auront l'occasion de discuter avec les leaders de l'eau et du climat lors de deux tables rondes. 

Ouverture (10 min)
Planter le décor - M. Gilbert Houngbo, Président de l'ONU-Eau ; Président du FIDA

Discussion en groupe (40 min)
- Intégrer l'adaptation dans le développement des politiques au niveau national - M. Komi Sélom Klassou, Ancien Premier Ministre, République du Togo
- La collaboration transfrontalière comme outil d'adaptation - Dr. Mohamed Abdel Aty, Ministre des Ressources en Eau et de l'Irrigation, Egypte
- Exemple de cas - M. Abdelkébir Zahoud, ancien secrétaire d'État à l'eau et à l'environnement, Royaume du Maroc
- Intégrer les agendas de l'eau et du climat et le rôle des données - M. Howard Bamsey, Président du Partenariat mondial pour l'eau.
- Innovation et rôle du secteur privé dans l'adaptation - M. Matthias Berninger, SVP Public Affairs & Sustainability BAYER
- La participation et l'inclusion des jeunes dans l'élaboration des politiques - Mme Lindsey Blodgétt, ancienne présidente du Parlement mondial des jeunes pour l'eau. 

Q&R (5 min)

Clôture (5 min)
Johannes Cullmann, Directeur Eau et Cryosphère, OMM

Modérateur des discussions de groupe : Johannes Cullmann, Directeur de l'eau et de la cryosphère, OMM";Intégration de l'eau et du climat | Données et informations | Politique | SDG6 | SDG13 ;World Meteorological Organization;60'
Panel de Haut Niveau;HLP05;Mise en place d'études épidémiologiques sur les eaux usées pour le suivi de la pandémie de COVID-19, extension de ces études à l'approche One -Health.;Mardi 22 mars de 13.30 à 15.00;Mardi 22 mars de 13.30 à 15.00;Salle 12;"Cette session est l'occasion de souligner l'importance d'utiliser la surveillance des eaux usées pour surveiller le SRAS-CoV-2 ainsi que les variantes du virus circulant dans la population. 

Objectifs principaux :
- L'objectif principal est de maximiser le potentiel de l'épidémiologie basée sur les eaux usées (WBE) pour garantir l'approche One Health en surveillant d'autres pathogènes, l'exposition humaine aux contaminants environnementaux, les biomarqueurs et la résistance aux antimicrobiens.

Résultats escomptés :
- La session développera une plateforme unifiée d'EMOH COVID-19 pour tous les groupes COVID-19 et discutera de la manière d'établir une coopération avec les centres mondiaux de maladies transmissibles (par exemple, ECDC, CDC, NICD, SAMRC) et les initiatives sanitaires mondiales et continentales (par exemple, OMS, HERA) afin de développer un mécanisme d'alerte précoce en cas de (ré)émergence de COVID-19 ou d'éventuelles pandémies futures. 
- La session fournira une plateforme pour les disciplines scientifiques, les associations de l'eau, les opérateurs de l'eau actifs au niveau mondial et les principaux acteurs pour développer des activités de renforcement des capacités au niveau mondial, en particulier pour les pays à revenu faible et intermédiaire. 
- Les résultats de la session soutiennent les objectifs de développement durable suivants : 2.4, 3.3, 3.D, 6.2, 6.3, 11.6, 14.1.  ";"""- Ouverture par le modérateur (5') 
-	
- Discours d'ouverture par LOÏC FAUCHON (5') (A inviter) 

- Courte table ronde avec les panélistes (1'x 10 ) 
Chaque panéliste se présentera et prendra des initiatives. 

- 1ère question du modérateur Réponses des 4 panélistes (3'x4)

- 2ème question du modérateur Réponses de 4 panélistes (3'x4)

- 3ème question du modérateur Réponses de 4 panélistes (3'x4)

- Le modérateur demande à la salle de poser des questions aux intervenants -Q&A (15')

- Commentaires de clôture de chaque panéliste (1'x10)

- Clôture par le modérateur (5')

*Les connexions à distance des intervenants seront autorisées. """;Surveillance des eaux usées | suivi du COVID-19 | SRAS-CoV-2 | WBE (Wastewater Based Epidemiology) | suivi des mutants/variants | réutilisation des eaux usées | une santé | santé publique ;Turkish Water Institute (SUEN);90'
Panel de Haut Niveau;HLP06;La route vers la conférence de l'ONU sur l'eau de 2023;Mardi 22 mars de 13.30 à 15.00;Mardi 22 mars de 13.30 à 15.00;Auditorium ;"Le Tadjikistan et les Pays-Bas accueilleront conjointement la conférence des Nations unies sur l'eau 2023 et s'engagent à en faire un moment décisif pour le monde entier. Conformément à cet engagement, ils organisent, conjointement avec le Sénégal, la session de haut niveau sur la conférence des Nations unies sur l'eau 2023 dans le cadre du 9e Forum mondial de l'eau afin d'attirer davantage l'attention et de promouvoir l'engagement des parties prenantes dans le processus préparatoire et la conférence elle-même.

La session de haut niveau sur la conférence de l'eau ONU 2023 est une vitrine et un événement interactif sur les bons exemples de coopération internationale en matière de gestion de l'eau. Les mesures les plus importantes pour un avenir durable doivent être prises dans le secteur de l'eau. Il s'agit d'une bonne occasion de présenter des exemples et de discuter des étapes nécessaires pour reproduire, mettre à l'échelle et tirer des leçons de ces exemples en vue de la Conférence des Nations Unies sur l'eau 2023.

La conférence des Nations unies sur l'eau 2023 étant la deuxième conférence jamais organisée par les Nations unies et la première après près de 50 ans, les attentes de la communauté internationale sont très élevées. Elle devrait être un moment décisif pour le monde entier. ";"XX:30-XX:35 Introduction à l'événement parallèle
Modérateur
Sulton Rahimzoda
Président du Comité exécutif du Fonds international pour le sauvetage de la mer d'Aral, Envoyé spécial du Président du Tadjikistan auprès du Groupe de haut niveau sur l'eau et le climat 
 
XX:35-XX:50 Remarques d'ouverture par les co-organisateurs (5 minutes chacun)
- Représentant de haut niveau du gouvernement de la République du Tadjikistan
- M. Mark Habers, (TBC) Ministre des infrastructures et de la gestion de l'eau du Royaume des Pays-Bas
- Représentant de haut niveau du gouvernement de la République du Sénégal

XX:50-XX:05 Présentation de la Conférence de l'ONU sur l'eau 2023
Représentant de l'UNDESA/UN-Water (à confirmer)

XX:05-XX:40 Segment de haut niveau (représentants de haut niveau)
1) Ministères nationaux ;
2) Autorités régionales et locales ;
3) Organisations intergouvernementales ;
4) Secteur privé ;
5) Etc.

XX:40-XX:15 Discussion du panel d'experts
1) Institutions financières ; 
2) ONG ;
3) Secteur privé ;
4) Grands groupes ;
5) Communauté scientifique/institutions académiques.

XX:15-XX:25 Questions et réponses

XX:25-XX:30 Résumé et conclusion
Henk Ovink,
Envoyé spécial pour les affaires internationales de l'eau du Royaume des Pays-Bas
";Eau et climat | Conférence de l'ONU sur l'eau 2023;Republic of Tajikistan, The Kingdom of the Netherlands, Senegal;90'
